{"command_receipt_sha256s":["b895ad5261acd60aa32ae56d81d1c10e7030a5f6ea1fbebae3ba4c21b24ac539"],"duration_ms":0,"external_session_assignment_sha256":"2e01882978114f57d94e23b1882981114dab1832dc35873be4044d3af20a42fe","findings":[],"handoff_sha256":"2db0600c02a64f913b064569a98f98b357cc208bbe3ee6ff352dfe0714edb3f5","protocol":"helios.build.review-receipt/v1","raw_evidence_sha256":"79437f3692bd0084db9d12cd8242b5d23e4e0269b7fbe5e3cc6051d63d3216b7","reviewer_profile_sha256":"7e2442dd99447f4f30b3d22e1363a9369c1675a76b0d3b3f2021f6f00611c8f3","source_verification":{"source_packet_ids":[],"source_record_ids":[]},"started_at":"2026-09-01T18:23:47.519323Z","task_manifest_sha256":"4d86abcf67e37d724b8def4ac1e4682f7d90a131a75fd3ff9997ab7161e90835","transport":"EXTERNAL_SESSION","verdict":"ACCEPTED"}