{"command_receipt_sha256s":["925148fd75272b27e5a8bbed0a0574d23f76f242b10eabf2d0cb8c19eabfc79d"],"duration_ms":0,"external_session_assignment_sha256":"efadf5dd4915733ce9eb4e90e6f2d4009e4f21c01299f3bf947c9c9401ac9c31","findings":[{"code":"CLI_ENUM_NORMALIZATION","severity":"MAJOR"}],"handoff_sha256":"f682f48d8775eb07c0d3da156a4b0b84df3999a94c1a7df2555e7393e8aa278b","protocol":"helios.build.review-receipt/v1","raw_evidence_sha256":"5ecbb3e467a5c1a1ddae23332f9b0b408b336b7cd2f3fafacd1d0c0b19a68171","reviewer_profile_sha256":"7e2442dd99447f4f30b3d22e1363a9369c1675a76b0d3b3f2021f6f00611c8f3","source_verification":{"source_packet_ids":[],"source_record_ids":[]},"started_at":"2026-09-01T16:40:20Z","task_manifest_sha256":"bc197ed65c19119a9a66fca50e7ea03dc5f266f67ffb0e448abf6919b8d3b56a","transport":"EXTERNAL_SESSION","verdict":"CHANGES_REQUIRED"}