{"command_receipt_sha256s":["fb69f284c463b23ee79c37e7cc4f2ddf714a6885e8eb13023571241132ad8a9f"],"duration_ms":0,"external_session_assignment_sha256":"f5726fdb904ac0519f7b216b2b0a637817a5434ceb5d7b261387839474cf71da","findings":[],"handoff_sha256":"798ecb677f210937228625b6199104355ce38f773bc18ae2ab5650e2e0842e88","protocol":"helios.build.review-receipt/v1","raw_evidence_sha256":"d71b89e66bacdf81f50cd96c133039baa7e0d2da2d406e72d48581ff334ba6f2","reviewer_profile_sha256":"7e2442dd99447f4f30b3d22e1363a9369c1675a76b0d3b3f2021f6f00611c8f3","source_verification":{"source_packet_ids":[],"source_record_ids":[]},"started_at":"2026-09-01T19:26:23.121128Z","task_manifest_sha256":"d7818473288fea00e14aa44c99d6b05077375edf317c7e772e093028804c9117","transport":"EXTERNAL_SESSION","verdict":"ACCEPTED"}