{"command_receipt_sha256s":["f154d8686c24d808ef23def9afdfdc4d05abad86e8a521f695ea648f8d4e087e"],"duration_ms":0,"external_session_assignment_sha256":"285e7674a672e3dd2042f0367ba226e4df243e188e64f8b691c84c25905a5f94","findings":[{"code":"PACK_HEADER_AUTHORITY_DIVERGENCE","severity":"CRITICAL"},{"code":"PROJECTION_FILTERS_FAIL_OPEN","severity":"CRITICAL"},{"code":"SQLITE_CONNECTION_LEAK","severity":"MAJOR"},{"code":"REGISTRY_EVENT_SEMANTICS_UNVERIFIED","severity":"MAJOR"},{"code":"SOURCE_IDENTITY_NOT_CONTENT_CANONICAL","severity":"MAJOR"},{"code":"SCHEMA_COMPILER_PARITY","severity":"MAJOR"},{"code":"DIV23_GRAPH_COVERAGE","severity":"MAJOR"}],"handoff_sha256":"71a6d407fa8d8775f3997bedaffdfa3bb0378b0703effdb4fcedf1aa7c9be129","protocol":"helios.build.review-receipt/v1","raw_evidence_sha256":"2df313b0dad39831ed312d78e7e7ee71fe1c05df9c6dd61e8d3a4b4264a38e63","reviewer_profile_sha256":"7e2442dd99447f4f30b3d22e1363a9369c1675a76b0d3b3f2021f6f00611c8f3","source_verification":{"source_packet_ids":[],"source_record_ids":[]},"started_at":"2026-09-01T17:39:11Z","task_manifest_sha256":"af00422557e8eb5bf06b99dfde8c6777d23f8af5c8f760d6bcbc853d2699f486","transport":"EXTERNAL_SESSION","verdict":"CHANGES_REQUIRED"}