{"command_receipt_sha256s":["40c97ece740c61e952865be18b42753e29345da47d903162dd4c8de8c29a694f"],"duration_ms":0,"external_session_assignment_sha256":"ccb28f2a72223bcb442d007f0ef07260815952fd46faf9acc8770b7eb839f832","findings":[{"code":"REGISTRY_BINDING_VALIDATION_BYPASS","severity":"MAJOR"},{"code":"PACKET_LINEAGE_ROOT_FORK","severity":"MAJOR"},{"code":"REQUEST_IDENTITY_EXPORT_RACE","severity":"MAJOR"},{"code":"SOURCE_DATES_ARE_SHAPE_ONLY","severity":"MAJOR"}],"handoff_sha256":"14cccf1aa35d49abfca7ea81dd7ca442d09d556ab898a8edbf9bf144ab97a754","protocol":"helios.build.review-receipt/v1","raw_evidence_sha256":"0bee085e8026ee42d4ea663afd79d86d1c7377888a988422c86b948c82a8818f","reviewer_profile_sha256":"7e2442dd99447f4f30b3d22e1363a9369c1675a76b0d3b3f2021f6f00611c8f3","source_verification":{"source_packet_ids":[],"source_record_ids":[]},"started_at":"2026-09-01T18:26:39.561268Z","task_manifest_sha256":"8efeed58f367f6984fea4fe3d33c41e27599246011eed26c99219e04caa58979","transport":"EXTERNAL_SESSION","verdict":"CHANGES_REQUIRED"}