{"command_receipt_sha256s":["d9165eebbee2ca2573a1cb4f5a777e5f3e73f8eb2d4f936bcf9d672dc27eee30"],"duration_ms":0,"external_session_assignment_sha256":"34d1fc0e688947c5570f0179142445adcf231d597017a0b9e2c93fec062980f0","findings":[],"handoff_sha256":"250e2733e83884cbdc8fdd258c65e9e5020c0f48a17447ea637ad0f3a862859d","protocol":"helios.build.review-receipt/v1","raw_evidence_sha256":"e60717cdb3729783e3243dd52a5f394d923d97aeac1d7906c989d18ab2b76818","reviewer_profile_sha256":"7e2442dd99447f4f30b3d22e1363a9369c1675a76b0d3b3f2021f6f00611c8f3","source_verification":{"source_packet_ids":[],"source_record_ids":[]},"started_at":"2026-09-01T16:55:17Z","task_manifest_sha256":"c1c0e67a963c90985a5dae08fead23ed1e204e8a5cc51148e7abe11d54ba9c4f","transport":"EXTERNAL_SESSION","verdict":"ACCEPTED"}