{"command_receipt_sha256s":["578b9f1422e9c9fae5b3db99e496487f8172924d9896f6b3556d84bce20077a4"],"duration_ms":0,"external_session_assignment_sha256":"fd1127c60e7f7f6ea5160619c3d82a5258a0a525191648c43a5c8b037c0b01e1","findings":[],"handoff_sha256":"97ec9011146d1f281575371ab428c7f1e2af5773f7a14efda8cd5eb1b292305d","protocol":"helios.build.review-receipt/v1","raw_evidence_sha256":"1e6e9c2e69478c33198b9f35cef1cca0bc69c65282ecf302fa150ec5975909fb","reviewer_profile_sha256":"7e2442dd99447f4f30b3d22e1363a9369c1675a76b0d3b3f2021f6f00611c8f3","source_verification":{"source_packet_ids":[],"source_record_ids":[]},"started_at":"2026-09-01T17:11:52.547563Z","task_manifest_sha256":"3993b8d0bfa76bd18b49b0054d868f073e5404cebcfccd60e4c5565ce0a8f0e9","transport":"EXTERNAL_SESSION","verdict":"ACCEPTED"}