{"command_receipt_sha256s":["681912e075065619ad8e93e1be18ae2d6b658ba254466f62701cd770dc3d5bfb"],"duration_ms":0,"external_session_assignment_sha256":"29d01ff17465269a5203b6ad7984df23fe1349a2bbfb8a9f8d5cff08afe66c24","findings":[],"handoff_sha256":"25b9ecac1dafa2bb930146af684a65b742cc2d18620221cd33661b674cd5307c","protocol":"helios.build.review-receipt/v1","raw_evidence_sha256":"cd500a9c6b7c64a7289b615a98e92feddfbfdd5a0ea71b955a267e9baeb5c891","reviewer_profile_sha256":"7e2442dd99447f4f30b3d22e1363a9369c1675a76b0d3b3f2021f6f00611c8f3","source_verification":{"source_packet_ids":[],"source_record_ids":[]},"started_at":"2026-09-01T18:50:10.747037Z","task_manifest_sha256":"7607569e69e36895aabb4ed87996dfd0701e6745dac1818d4f88e5887f96cf8f","transport":"EXTERNAL_SESSION","verdict":"ACCEPTED"}